{
  "schemaVersion": 1,
  "mode": "pending-review",
  "reviewStatus": "needs-legal-review",
  "reviewedAt": null,
  "reviewedBy": null,
  "editorialReference": "Madden NFL 26",
  "killSwitch": "disable-madden-nfl-26",
  "licenseRecord": null,
  "forbiddenMotifs": [
    "Madden, NFL, EA, team, or league marks",
    "recognizable athlete likenesses",
    "official uniforms, stadiums, or broadcast graphics"
  ],
  "provenance": {
    "sourceBoard": "assets/game-packs/madden-nfl-26/source-board.md",
    "reviewEvidence": []
  }
}
